# 2005 July 22
#
# The author disclaims copyright to this source code.  In place of
# a legal notice, here is a blessing:
#
#    May you do good and not evil.
#    May you find forgiveness for yourself and forgive others.
#    May you share freely, never taking more than you give.
#
#***********************************************************************
# This file implements regression tests for SQLite library.
# This file implements tests for the ANALYZE command.
#
# $Id: analyze.test,v 1.9 2008/08/11 18:44:58 drh Exp $

set testdir [file dirname $argv0]
source $testdir/tester.tcl

# There is nothing to test if ANALYZE is disable for this build.
#
#ifcapable {!analyze} {
#  finish_test
#  return
#}

# Basic sanity checks.
#
do_test analyze-1.1 {
  catchsql {
    ANALYZE nosuchtable
  }
} {1 {Internal Error}}
do_test analyze-1.2 {
  execsql {
    SELECT count(*) FROM sqlite_master WHERE name='sqlite_stat1'
  }
} {1}
comdb2_omit_test do_test analyze-1.3 {
  gcatchsql {
    ANALYZE nosuchdb.nosuchtable
  }
} {1 {unknown database no_such_db}}
comdb2_omit_test do_test analyze-1.4 {
  execsql {
    SELECT count(*) FROM sqlite_master WHERE name='sqlite_stat1'
  }
} {0}
do_test analyze-1.5.1 {
  execsql {
    ANALYZE
  }
} {}
do_test analyze-1.5.2 {
  catchsql {
    ANALYZE
  }
} {}
do_test analyze-1.6 {
  execsql {
    SELECT count(*) FROM sqlite_master WHERE name='sqlite_stat1'
  }
} {1}
comdb2_omit_test do_test analyze-1.6.2 {
  catchsql {
    CREATE INDEX stat1idx ON sqlite_stat1(idx);
  }
} {1 {table sqlite_stat1 may not be indexed}}
comdb2_omit_test do_test analyze-1.6.3 {
  catchsql {
    CREATE INDEX stat1idx ON sqlite_stat1(idx);
  }
} {1 {table sqlite_stat1 may not be indexed}}
do_test analyze-1.7 {
  execsql {
    SELECT * FROM sqlite_stat1 WHERE idx NOT NULL
  }
} {}
comdb2_omit_test do_test analyze-1.8 {
  catchsql {
    ANALYZE main
  }
} {0 {}}
do_test analyze-1.9 {
  execsql {
    SELECT * FROM sqlite_stat1 WHERE idx NOT NULL
  }
} {}
do_test analyze-1.10.1 {
  catchsql {
    CREATE TABLE t1(a,b);
  }
} {}
do_test analyze-1.10.2 {
  catchsql {
    ANALYZE
  }
} {}
do_test analyze-1.11 {
  execsql {
    SELECT * FROM sqlite_stat1
  }
} {}
#AZ: the following 'Error: child process exited abnormally' -- don't know why
comdb2_omit_test do_test analyze-1.12 {
  catchsql {
    ANALYZE t1
  }
} {}
do_test analyze-1.13 {
  execsql {
    SELECT * FROM sqlite_stat1
  }
} {}

# Create some indices that can be analyzed.  But do not yet add
# data.  Without data in the tables, no analysis is done.
#
do_test analyze-2.1 {
  execsql {
    CREATE INDEX t1i1 ON t1(a);
    ANALYZE t1;
    SELECT * FROM sqlite_stat1 ORDER BY idx;
  }
} {}
do_test analyze-2.2 {
  execsql {
    CREATE INDEX t1i2 ON t1(b);
    ANALYZE t1;
    SELECT * FROM sqlite_stat1 ORDER BY idx;
  }
} {}
do_test analyze-2.3 {
  execsql {
    CREATE INDEX t1i3 ON t1(a,b);
    ANALYZE;
    SELECT * FROM sqlite_stat1 ORDER BY idx;
  }
} {}

# Start adding data to the table.  Verify that the analysis
# is done correctly.
#
do_test analyze-3.1 {
  execsql {
    INSERT INTO t1 VALUES(1,2);
    INSERT INTO t1 VALUES(1,3);
    ANALYZE t1;
    SELECT idx, stat FROM sqlite_stat1 ORDER BY idx;
  }
} {{$T1I1_433F50E9} {2 2} {$T1I2_DA360153} {2 1} {$T1I3_A82B8A75} {2 2 1}}
#} {t1i1 {2 2} t1i2 {2 1} t1i3 {2 2 1}}
do_test analyze-3.2 {
  execsql {
    INSERT INTO t1 VALUES(1,4);
    INSERT INTO t1 VALUES(1,5);
    ANALYZE t1;
    SELECT idx, stat FROM sqlite_stat1 WHERE tbl not like 'cdb2.%.sav' ORDER BY idx;
  }
} {{$T1I1_433F50E9} {4 4} {$T1I2_DA360153} {4 1} {$T1I3_A82B8A75} {4 4 1}}
#} {t1i1 {4 4} t1i2 {4 1} t1i3 {4 4 1}}
do_test analyze-3.3 {
  execsql {
    INSERT INTO t1 VALUES(2,5);
    ANALYZE;
    SELECT idx, stat FROM sqlite_stat1 WHERE tbl not like 'cdb2.%.sav' ORDER BY idx;
  }
} {{$T1I1_433F50E9} {5 3} {$T1I2_DA360153} {5 2} {$T1I3_A82B8A75} {5 3 1}}
#} {t1i1 {5 3} t1i2 {5 2} t1i3 {5 3 1}}
do_test analyze-3.4 {
  execsql {
    CREATE TABLE t2 AS SELECT * FROM t1;
    CREATE INDEX t2i1 ON t2(a);
    CREATE INDEX t2i2 ON t2(b);
    CREATE INDEX t2i3 ON t2(a,b);
    ANALYZE;
    SELECT idx, stat FROM sqlite_stat1 WHERE tbl not like 'cdb2.%.sav' ORDER BY idx;
  }
} {{$T1I1_433F50E9} {5 3} {$T1I2_DA360153} {5 2} {$T1I3_A82B8A75} {5 3 1} {$T2I1_49F2A39} {5 3} {$T2I2_9D967B83} {5 2} {$T2I3_2EBFF8DB} {5 3 1}}
do_test analyze-3.5.1 {
  execsql {
    DROP INDEX t2i3;
  }
} {}
do_test analyze-3.5.2 {
  execsql {
    ANALYZE t1;
  }
} {}
do_test analyze-3.5.3 {
  execsql {
    SELECT idx, stat FROM sqlite_stat1 WHERE tbl not like 'cdb2.%.sav' ORDER BY idx;
  }
} {{$T1I1_433F50E9} {5 3} {$T1I2_DA360153} {5 2} {$T1I3_A82B8A75} {5 3 1} {$T2I1_49F2A39} {5 3} {$T2I2_9D967B83} {5 2} {$T2I3_2EBFF8DB} {5 3 1}}
do_test analyze-3.6 {
  execsql {
    ANALYZE t2;
    SELECT idx, stat FROM sqlite_stat1 WHERE tbl not like 'cdb2.%.sav' ORDER BY idx;
  }
} {{$T1I1_433F50E9} {5 3} {$T1I2_DA360153} {5 2} {$T1I3_A82B8A75} {5 3 1} {$T2I1_49F2A39} {5 3} {$T2I2_9D967B83} {5 2}}
do_test analyze-3.7 {
  execsql {
    DROP INDEX t2i2;
    ANALYZE t2;
    SELECT idx, stat FROM sqlite_stat1 WHERE tbl not like 'cdb2.%.sav' ORDER BY idx;
  }
} {{$T1I1_433F50E9} {5 3} {$T1I2_DA360153} {5 2} {$T1I3_A82B8A75} {5 3 1} {$T2I1_49F2A39} {5 3}}
do_test analyze-3.8 {
  execsql {
    CREATE TABLE t3 (a,b,c,d);
    INSERT INTO t3 SELECT a, b, 1 AS c, 5 AS d FROM t1;
    CREATE INDEX t3i1 ON t3(a);
    CREATE INDEX t3i2 ON t3(a,b,c,d);
    CREATE INDEX t3i3 ON t3(d,b,c,a);
    DROP TABLE t1;
    DROP TABLE t2;
    SELECT idx, stat FROM sqlite_stat1 WHERE tbl not like 'cdb2.%.sav' ORDER BY idx;
  }
} {{$T1I1_433F50E9} {5 3} {$T1I2_DA360153} {5 2} {$T1I3_A82B8A75} {5 3 1} {$T2I1_49F2A39} {5 3}}
do_test analyze-3.9 {
  execsql {
    ANALYZE;
    SELECT idx, stat FROM sqlite_stat1 WHERE tbl not like 'cdb2.%.sav' ORDER BY idx;
  }
} {{$T3I1_39FF0389} {5 3} {$T3I2_58D6C701} {5 3 1 1 1} {$T3I3_1F62C3BC} {5 5 2 2 1}}

do_test analyze-3.10 {
  execsql {
    CREATE TABLE sillyname (a, b, c);
    CREATE INDEX foolishname ON silly_name(a, b);
    CREATE INDEX anotherfoolishname ON sillyname(c);
    INSERT INTO [sillyname] VALUES(1, 2, 3);
    INSERT INTO [sillyname] VALUES(4, 5, 6);
    ANALYZE;
    SELECT idx, stat FROM sqlite_stat1 WHERE tbl not like 'cdb2.%.sav' ORDER BY idx;
  }
} {1 {Table not found} {$ANOTHERFOOLISHNAME_6DBDCA38} {2 1} {$T3I1_39FF0389} {5 3} {$T3I2_58D6C701} {5 3 1 1 1} {$T3I3_1F62C3BC} {5 5 2 2 1}}
do_test analyze-3.11 {
  execsql {
    DROP INDEX foolishname;
    SELECT idx, stat FROM sqlite_stat1 WHERE tbl not like 'cdb2.%.sav' ORDER BY idx;
  }
} {{$ANOTHERFOOLISHNAME_6DBDCA38} {2 1} {$T3I1_39FF0389} {5 3} {$T3I2_58D6C701} {5 3 1 1 1} {$T3I3_1F62C3BC} {5 5 2 2 1}}
do_test analyze-3.12 {
  execsql {
    DROP TABLE sillyname;
    analyze;
    SELECT idx, stat FROM sqlite_stat1 WHERE tbl not like 'cdb2.%.sav' ORDER BY idx;
  }
} {{$T3I1_39FF0389} {5 3} {$T3I2_58D6C701} {5 3 1 1 1} {$T3I3_1F62C3BC} {5 5 2 2 1}}

do_test analyze-3.13 {
  execsql {
    SELECT idx,count() FROM sqlite_stat4 WHERE tbl in (select name from sqlite_master where type='table') group by idx;
  }
} {{$T3I1_39FF0389} 5 {$T3I2_58D6C701} 5 {$T3I3_1F62C3BC} 5}


# Try corrupting the sqlite_stat1 table and make sure the
# database is still able to function.
#
do_test analyze-4.0 {
  execsql {
    CREATE TABLE t4(x,y,z);
    CREATE INDEX t4i1 ON t4(x);
    CREATE INDEX t4i2 ON t4(y);
    INSERT INTO t4 SELECT a,b,c FROM t3;
    ANALYZE;
    SELECT idx, stat FROM sqlite_stat1 WHERE tbl not like 'cdb2.%.sav' ORDER BY idx;
  }
} {{$T3I1_39FF0389} {5 3} {$T3I2_58D6C701} {5 3 1 1 1} {$T3I3_1F62C3BC} {5 5 2 2 1} {$T4I1_EFB47759} {5 3} {$T4I2_98B347CF} {5 2}}
comdb2_omit_test do_test analyze-4.1 {
  execsql {
    PRAGMA writable_schema=on;
    INSERT INTO sqlite_stat1 VALUES(null,null,null);
    PRAGMA writable_schema=off;
    SELECT * FROM t4 WHERE x=1234;
  }
} {}
do_test analyze-4.2 {
  execsql {
    DELETE FROM sqlite_stat1 WHERE 1;
    INSERT INTO sqlite_stat1 VALUES('t4','t4i1','nonsense');
    INSERT INTO sqlite_stat1 VALUES('t4','t4i2','120897349817238741092873198273409187234918720394817209384710928374109827172901827349871928741910');
    SELECT * FROM t4 WHERE x=1234;
  }
} {}
do_test analyze-4.3 {
  execsql {
    INSERT INTO sqlite_stat1 VALUES('t4','xyzzy','0 1 2 3');
    SELECT * FROM t4 WHERE x=1234;
  }
} {}

# Verify that DROP TABLE and DROP INDEX remove entries from the 
# sqlite_stat1, sqlite_stat3 and sqlite_stat4 tables.
#
do_test analyze-5.0 {
  execsql {
    DELETE FROM t3;
    DELETE FROM t4;
    INSERT INTO t3 VALUES(1,2,3,4);
    INSERT INTO t3 VALUES(5,6,7,8);
    INSERT INTO t3 SELECT a+8, b+8, c+8, d+8 FROM t3;
    INSERT INTO t3 SELECT a+16, b+16, c+16, d+16 FROM t3;
    INSERT INTO t3 SELECT a+32, b+32, c+32, d+32 FROM t3;
    INSERT INTO t3 SELECT a+64, b+64, c+64, d+64 FROM t3;
    INSERT INTO t4 SELECT a, b, c FROM t3;
    ANALYZE;
    SELECT DISTINCT idx FROM sqlite_stat1 WHERE tbl not like 'cdb2.%.sav' ORDER BY 1;
    SELECT DISTINCT tbl FROM sqlite_stat1 WHERE tbl not like 'cdb2.%.sav' ORDER BY 1;
  }
} {{$T3I1_39FF0389} {$T3I2_58D6C701} {$T3I3_1F62C3BC} {$T4I1_EFB47759} {$T4I2_98B347CF} t3 t4}
set stat sqlite_stat4
do_test analyze-5.1 {
    execsql "
      SELECT DISTINCT idx FROM $stat WHERE tbl not like 'cdb2.%.sav' ORDER BY 1;
      SELECT DISTINCT tbl FROM $stat WHERE tbl in (select name from sqlite_master where type='table') ORDER BY 1;
    "
} {{$T3I1_39FF0389} {$T3I2_58D6C701} {$T3I3_1F62C3BC} {$T4I1_EFB47759} {$T4I2_98B347CF} t3 t4}
do_test analyze-5.2 {
  execsql {
    DROP INDEX t3i2;
    ANALYZE;
    SELECT DISTINCT idx FROM sqlite_stat1 WHERE tbl not like 'cdb2.%.sav' ORDER BY 1;
    SELECT DISTINCT tbl FROM sqlite_stat1 WHERE tbl not like 'cdb2.%.sav' ORDER BY 1;
  }
} {{$T3I1_39FF0389} {$T3I3_1F62C3BC} {$T4I1_EFB47759} {$T4I2_98B347CF} t3 t4}
do_test analyze-5.3 {
    execsql "
      SELECT DISTINCT idx FROM $stat WHERE tbl not like 'cdb2.%.sav' ORDER BY 1;
      SELECT DISTINCT tbl FROM $stat WHERE tbl in (select name from sqlite_master where type='table') ORDER BY 1;
    "
  } {{$T3I1_39FF0389} {$T3I3_1F62C3BC} {$T4I1_EFB47759} {$T4I2_98B347CF} t3 t4}
do_test analyze-5.4 {
  execsql {
    DROP TABLE t3;
    ANALYZE;
    SELECT DISTINCT idx FROM sqlite_stat1 WHERE tbl not like 'cdb2.%.sav' ORDER BY 1;
    SELECT DISTINCT tbl FROM sqlite_stat1 WHERE tbl not like 'cdb2.%.sav' ORDER BY 1;
  }
} {{$T4I1_EFB47759} {$T4I2_98B347CF} t4}
do_test analyze-5.5 {
    execsql "
      SELECT DISTINCT idx FROM $stat WHERE tbl not like 'cdb2.%.sav' ORDER BY 1;
      SELECT DISTINCT tbl FROM $stat WHERE tbl in (select name from sqlite_master where type='table') ORDER BY 1;
    "
} {{$T4I1_EFB47759} {$T4I2_98B347CF} t4}

# Ticket [cfa2c908f218254d7be64aa4b8fa55ba4df20853] 2017-06-13
# Assertion fault in STAT4 on a double-negation.
#
do_test analyze-6.0 {
    execsql {
      CREATE TABLE t5(x);
      CREATE INDEX t5x ON t5(x);
      INSERT INTO t5 VALUES(1),(2),(3);
      ANALYZE;
      SELECT x FROM t5 WHERE x = -(-1);
    }
} {1}

# This test corrupts the database file so it must be the last test
# in the series.
#
do_test analyze-99.1 {
  catchsql {
    UPDATE sqlite_master SET sql='nonsense' WHERE name='sqlite_stat1';
  }
} {1 {table sqlite_master may not be modified}}
do_test analyze-99.2 {
  catchsql {
    ANALYZE;
  }
} {}


finish_test
